লক্ষ্যমাত্রার,lakshyamatra,লক্ক্যমাত্রার,lakkyamatra," lakshyamatra, lakshamatra, lokmatra, lokmatk, lokmat, "," লক্ষ্যমাত্রা, লক্ষমাত্র, লোকমাত্র, লোকমতকে, লোকমত, ",no
প্রবৃদ্ধি,pravruddhi,পরবৃদ্ধি,parvruddhi," pravruddhi, pravruddhir, padavruddhi, dalvruddhi, jalvruddhi, "," প্রবৃদ্ধি, প্রবৃদ্ধির, পদবৃদ্ধি, দলবৃদ্ধি, জলবৃদ্ধি, ",yes
সম্ভাব্য,sambhavya,সবাব্য,sawavya," sahayya, sadasya, samanya, samasya, safalya, "," সাহায্য, সদস্য, সামান্য, সমস্যা, সাফল্য, ",no
তথ্য,tathy,তেথ,teth," tathy, desh, tenth, keh, tech, "," তথ্য, দেশ, tenth, কেহ, টেক, ",yes
চূড়ান্ত,chudanta,চূড়ানত,chudanath," chudanta, chudantavave, shwadhinotar, shwadhinota, swatantra, "," চূড়ান্ত, চূড়ান্তভাবে, স্বাধীনতার, স্বাধীনতা, স্বতন্ত্র, ",yes
উল্লেখ্য,ullekhya,উললেখ্য,ulalekhya," ullekhya, alekhya, iluliake, jhaal_laaga, jalilke, "," উল্লেখ্য, আলেখ্য, ইলুলিয়াকে, ঝাল_লাগা, জলিলকে, ",yes
সদ্য,sadya,সদা,sada," sada, saada, pada, dada, sadar, "," সদা, সাদা, পড়া, দাদা, সদর, ",no
সমাপ্ত,samapth,সমাপত,samapat," samapan, samaran, samarpan, samaja, samapa, "," সমাপন, স্মরণ, সমর্পণ, সমাজে, সমাপয়েৎ, ",no
অর্থাৎ,artha,অরতাৎ,arta," artha, karia, arth, karta, varta, "," অর্থাৎ, করিয়া, অর্থ, কর্তা, বার্তা, ",yes
উচ্চাকাঙ্ক্ষী,ucchakankshi,উচচাকাঙ্ক্ষী,uchachakankshi," ucchakankshi, uchchakanth, uchchakanther, ucchakakshati, uchch_kamishan, "," উচ্চাকাঙ্ক্ষী, উচ্চকণ্ঠে, উচ্চকণ্ঠের, উচ্চকক্ষটি, উচ্চ_কমিশন, ",yes
কাঙ্ক্ষিত,kankshit,কাংক্ষিত,kankshit," kankshit, sankshipt, akankshit, kankhit, rakshit, "," কাঙ্ক্ষিত, সংক্ষিপ্ত, আকাঙ্ক্ষিত, কাঙ্খিত, রক্ষিত, ",yes
প্লাজা,plazas,পলাজা,palaja," palaia, paala, samaja, alada, halaka, "," পালাইয়া, পেয়ালা, সমাজে, আলাদা, হালকা, ",no
যুক্তরাষ্ট্রের,yuktarastrer,যুকতরাষ্ট্রের,yuktarashtrer," yuktarastrer, yuktarashtra, yuktarashtrao, yuktarashtrayen, yuktarashtrasah, "," যুক্তরাষ্ট্রের, যুক্তরাষ্ট্র, যুক্তরাষ্ট্রও, যুক্তরাষ্ট্রযেন, যুক্তরাষ্ট্রসহ, ",yes
অগ্রাধিকারমূলক,agradhikarmulak,অগরাধিকারমূলক,agaradhikarmulak," agradhikarmulak, agradhikargulo, agradhikar, agradhikarer, agradhikarprapth, "," অগ্রাধিকারমূলক, অগ্রাধিকারগুলো, অগ্রাধিকার, অগ্রাধিকারের, অগ্রাধিকারপ্রাপ্ত, ",yes
বর্তমান,bartaman,বরটমান,baratman," bartaman, brahman, bhraman, maratmak, bartamang, "," বর্তমান, ব্রাহ্মণ, ভ্রমণ, মারাত্মক, বর্তমানগ, ",yes
প্রশ্নের,prashner,পরশ্নের,parashner," prashner, paresher, prashn, parashrer, prashne, "," প্রশ্নের, পরেশের, প্রশ্ন, পরাশরের, প্রশ্নে, ",yes
প্লাজার,plazar,পলাজার,palazar," palabar, plazar, palaia, balaar, paatar, "," পালাবার, প্লাজার, পালাইয়া, বলার, পাতার, ",yes
প্রবৃদ্ধির,pravruddhir,পরবৃদ্ধির,parvruddhir," pravruddhir, pravruddhi, dalvruddhir, darbruddhir, pravruddhirai, "," প্রবৃদ্ধির, প্রবৃদ্ধি, দলবৃদ্ধির, দরবৃদ্ধির, প্রবৃদ্ধিরই, ",yes
প্রতিযোগী,pratiyogi,পরতিযোগী,paratiyogi," pratiyogi, pratiyog, apratiyogi, pratiyogitar, parityag, "," প্রতিযোগী, প্রতিযোগ, অপ্রতিযোগী, প্রতিযোগিতার, পরিত্যাগ, ",yes
প্রতিযোগিতার,pratiyogitar,পরতিযোগিতার,paratiyogitar," pratiyogitar, pratiyogita, pratiyogitai, pratiyogitati, pratiyogider, "," প্রতিযোগিতার, প্রতিযোগীতা, প্রতিযোগিতাই, প্রতিযোগিতাটি, প্রতিযোগীদের, ",yes
পণ্যের,panyer,পেণের,pener," paner, maner, opener, premer, praner, "," পানের, মানের, ওপেনের, প্রেমের, প্রাণের, ",no
বাণিজ্যসচিব,banisyasachib,বাণিেজসচিব,banijaschib," panyayajishala, punjishayata, pingesh, "," পণ্যযজ্ঞশালায়, পুঁজিসহায়তা, পিঙ্গেশ, ",no
অনুষ্ঠেয়,anushtheya,অনুষতেয়,anuteya," anumeya, anunaya, kaunteya, anitya, anite, "," অনুমেয়, অনুনয়, কৌন্তেয়, অনিত্য, আনিতে, ",no
নির্ধারণ,nirdharan,নিরডারণ,nirderan," nirdharan, nirderai, nirder, nirdharn, nirdhari, "," নির্ধারণ, নীরদেরই, নীরদের, নির্ধারণে, নির্ধারিত, ",yes
প্রাথমিকভাবে,prathmikbhave,পরাথমিকভাবে,parathmikbhave," prathmikbhave, pratham, prathame, prathmat, prathambarer, "," প্রাথমিকভাবে, প্রথমে, প্রথমেই, প্রথমত, প্রথমবারের, ",yes
প্রস্তুত,present,পরস্তুত,parastut," prastuti, parashu, prastab, aprastt, aprastute, "," প্রস্তুতি, পরশু, প্রস্তাব, অপ্রস্তুত, অপ্রস্তুতে, ",no
অস্থিরতা,asthirata,অসতিরতা,asatirata," asthirata, asarata, aastikata, astrata, asatyata, "," অস্থিরতা, অসারতা, আস্তিকতা, অস্ত্রটা, অসত্যতা, ",yes
অসন্তোষ,asantos,অসনতোষ,asanatosh," asantos, asantust, asantosher, asantoso, asantose, "," অসন্তোষ, অসন্তুষ্ট, অসন্তোষের, অসন্তোষও, অসন্তোষে, ",yes
শর্তের,sharter,শরতের,sharter," sharter, bharter, gharer, sharir, sharte, "," শর্তের, ভারতের, ঘরের, শরীর, শর্তে, ",yes
অর্জন,arjan,অরজন,arajan," arjan, ekajan, raja, grahan, ramajan, "," অর্জন, একজন, রাজা, গ্রহণ, রমজান, ",yes
সম্ভব,sambhava,সবব,sabb," shabd, jabab, sabha, saheb, sabek, "," শব্দ, জবাব, সভা, সাহেব, সাবেক, ",no
শিল্পকে,shilpke,শিলপকে,shilpke," shilpke, shilpike, shilpe, shilake, shilp, "," শিল্পকে, শিল্পীকে, শিল্পে, শিলাকে, শিল্প, ",yes
প্রাধান্য,praadhanya,পরাধান্য,paradhanya," praadhanya, pradhan, pradhanya, paradin, aradhana, "," প্রাধান্য, প্রধান, প্রধান্য, পরদিন, আরাধনা, ",yes
প্রচেষ্টা,pracheshta,পরচেষ্টা,parcheshta," pracheshta, panchishta, pariksha, apacheshta, panchashta, "," প্রচেষ্টা, পঁচিশটা, পরীক্ষা, অপচেষ্টায়, পঞ্চাশটা, ",yes
সামান্য,samanya,সামানা,samana," samanya, samaja, samay, saman, kamala, "," সামান্য, সমাজে, সময়, সামনে, কমলা, ",yes
সুরক্ষার,surakshar,সুরক্কার,surakkar," sarkar, surakshar, puraskar, surkar, suryakar, "," সরকার, সুরক্ষার, পুরস্কার, সুরকার, সূর্যকর, ",yes
পরিলক্ষিত,parilakshit,পরিলক্কিত,parilkkit," parilakshit, parilok, parloke, parlaukik, parlokgat, "," পরিলক্ষিত, পরীলোক, পরলোকে, পারলৌকিক, পরলোকগত, ",yes
স্বস্তি,swasti,সস্তি,sasti," shasti, sasta, shakti, sati, swasti, "," শাস্তি, সস্তা, শক্তি, সতী, স্বস্তি, ",yes
পুনর্বিন্যাস,punarvinyas,পুনরিন্যাস,punarinyas," punarvinyas, punarniyukt, punarnyoga, punarnisha, punrnva, "," পুনর্বিন্যাস, পুনর্নিযুক্ত, পুনর্নিয়োগ, পুনর্নিশা, পুনর্নবা, ",yes
ফ্ল্যাট,flat,ফল্যাট,falat," falat, balat, lalat, falta, falar, "," ফলত, বলত, ললাট, ফলটা, ফলার, ",no
হস্তান্তর,hastantar,হসটান্তর,hastantar," hastantar, hastantare, hastantarer, matantar, hastantarit, "," হস্তান্তর, হস্তান্তরে, হস্তান্তরের, মতান্তর, হস্তান্তরিত, ",yes
ক্রয়মূল্যের,kraymoolyer,করয়মূল্যের,karaymoolyer," kraymoolyer, garemaliker, karimulla, caramel, gramilphoner, "," ক্রয়মূল্যের, গ্যারেজমালিকের, করিমউল্লা, ক্যারামেল, গ্রামীণফোনের, ",yes
অন্যদিকে,anayadike,অনাদিকে,anadike," anadike, anayadike, nadike, analine, nadite, "," আনাড়িকে, অন্যদিকে, নদীকে, অনলাইন, নদীতে, ",yes
গুচ্ছ,guchchha,গুছছ,gunars," guna, gurs, guner, gunate, guard, "," গুণ, গূঢ়, গুণের, গুনতে, গার্ড, ",no
ভ্যাটের,vater,েভাটের,bhater," bhater, bharter, bhaver, bhayer, khater, "," ভাতের, ভারতের, ভাবের, ভাইয়ের, খাতের, ",no
পণ্যে,panye,পণাে,pana," pawa, pada, pana, pan, panya, "," পাওয়া, পড়া, পণও, পান, পণ্য, ",no
নিয়ন্ত্রণমূলক,niyantranamulak,নিয়নত্রণমূলক,niyantranamulak," niyantranamulak, niyantrane, niyantranadhin, niyantraner, niyantraneuch, "," নিয়ন্ত্রণমূলক, নিয়ন্ত্রণে, নিয়ন্ত্রণাধীন, নিয়ন্ত্রণের, নিয়ন্ত্রণেউচ্চ, ",yes
প্রকৃত,prakrut,পরকৃত,parkrut," prakrut, prakruti, prakrutir, parivrut, upakrut, "," প্রকৃত, প্রকৃতি, প্রকৃতির, পরিবৃত, উপকৃত, ",yes
অর্থে,arthe,অরতে,arte," aste, karte, arte, arth, barite, "," আস্তে, করতেই, আড়তে, অর্থ, বাড়িতে, ",no
মধ্যবর্তী,madhyavarti,মেধবর্তী,medhvarti," madhyavarti, medhavir, medhavira, madhyavarti_grah, mathvirodh, "," মধ্যবর্তী, মেধাবীর, মেধাবীরা, মধ্যবর্তী_গ্রহ, মতবিরোধ, ",yes
শুল্কের,shulker,শুলকের,shulaker," shulker, shataker, pulaker, shloker, shilake, "," শুল্কের, শতকের, পুলকের, শ্লোকের, শিলাকে, ",yes
অতিরিক্ত,atirikt,অতিরিকত,atirikat," atirikt, atiriktmatra, adrika, atarkit, yatarkam, "," অতিরিক্ত, অতিরিক্তমাত্রায়, অদ্রিকা, অতর্কিত, যতরকম, ",yes
সুরক্ষায়,suraksha,সুরক্কায়,surakka," surama, suraksha, suraha, surasika, suramya, "," সুরমা, সুরক্ষা, সুরাহা, সুরসিকা, সুরম্য, ",no
জাহাজনির্মাণ,jahajanirman,জাহাজনিরাণ,jahazniran," ihasaner, ihasansar, ihasanakari, ihasanakarider, ihasanoi, "," ইহসানের, ইহসংসার, ইহসানকারী, ইহসানকারীদের, ইহসানই, ",no
অর্থবছর,arthvashwar,অরটবছর,artabler," tabler, hartaler, araler, kartaler, stabler, "," টেবিলের, হরতালের, আড়ালের, করতালের, আস্তাবলের, ",no
ডিডব্লিউটি,didbluty,ডিডলিউটি,didcuty," didbluty, dedicated, diedugdugi, dudhyukt, tadgat, "," ডিডব্লিউটি, ডেডিকেটেড, দিয়েডুগডুগি, দুধযুক্ত, তদগত, ",yes
ক্ষমতার,kshamtar,খমতার,khamtar," khabar, kshamtar, khatar, khaata, chamkar, "," খবর, ক্ষমতার, খাতার, খাতা, চমৎকার, ",yes
বিস্কুটশিল্পকে,biskutshilpke,বিসকুটশিল্পকে,biskutshilpke," biskutshilpke, biscuttake, basketbale, biscuter, biscuit, "," বিস্কুটশিল্পকে, বিস্কুটটাকে, বাস্কেটবলে, বিস্কুটের, বিস্কুট, ",yes
রক্ষা,raksha,রক্কা,rakka," rakta, rakhia, taka, raja, raka, "," রক্ত, রাখিয়া, টাকা, রাজা, রাকা, ",no
বিস্কুটের,biscuter,বিসকুটের,biskuter," biscuter, irkuter, biscuto, biscuit, bayskader, "," বিস্কুটের, ইরকুটের, বিস্কুটও, বিস্কুট, বয়স্কদের, ",yes
পরিচর্যার,parichara,পরিচরাার,parichara," parichay, parichalak, parichara, paricharya, parihar, "," পরিচয়, পরিচালক, পরিচর্যার, পরিচর্যা, পরিহার, ",yes
সামগ্রীর,samgri,সামগরীর,samgari," samgri, sampark, sarkari, samari, saagari, "," সামগ্রী, সম্পর্ক, সরকারি, সময়ই, সাগরী, ",no
ফেব্রিকসের,febrikser,ফেরিকসের,fericser," febrikser, viracer, virager, worker, veruci_rog, "," ফেব্রিকসের, ভাইরাসের, বিরাগের, ওয়ার্কার, বেরুকী_রোগ, ",yes
শিল্পমালিকদের,shilpmalikder,শিলপমালিকদের,shilpamalikder," shilpmalikder, shilpamantri, shilpmadhuryer, swalpamayade, swalpamaadi, "," শিল্পমালিকদের, শিল্পমন্ত্রী, শিল্পমাধুর্যের, স্বল্পমেয়াদে, স্বল্পমেয়াদি, ",yes
রাজস্ব,rajasav,রাজস,raajas," raja, ramajan, raaga, saahas, rajak, "," রাজা, রমজান, রাগ, সাহস, রজক, ",no
বোর্ড,board,বোরদ,borad," board, brad, baradd, boza, morad, "," বোর্ড, ব্র্যাড, বরাদ্দ, বোঝা, মোরাদ, ",yes
হাইব্রিড,hybrid,হাইরিড,hirid," firia, hirhid, tiri, firie, hrid, "," ফিরিয়া, হিড়্‌‍হিড়্, তৈরী, ফিরিয়ে, হৃদ্, ",no
জ্বালানি,jvalani,জালানি,jalani," jaani, janani, jvalani, jaan, jalpani, "," জানি, জননী, জ্বালানি, জান, জলপানি, ",yes
সাশ্রয়ী,sashryi,সাশরয়ী,sasharyi," mashari, sashryi, asharai, masharai, asharhi, "," মশারি, সাশ্রয়ী, আশারই, মশারাই, আষাঢ়ী, ",yes
শুল্কমুক্ত,shulkamukta,শুলকমুক্ত,shulkamukta," shulkamukta, shalgam, chelachamundader, chalkumdo_khichudi, "," শুল্কমুক্ত, শালগম, চেলাচামুন্ডাদের, চালকুমড়োর_খিচুড়ী, ",yes
দীর্ঘদিন,dirghdin,দীরঘদিন,dirandin," dirghdin, dainandin, durant, tirandaj, durgndh, "," দীর্ঘদিন, দৈনন্দিন, দুরন্ত, তীরন্দাজ, দুর্গন্ধ, ",yes
ব্যাপক,vapak,বাাপক,bapak," bapake, vapak, baba, bahak, barak, "," বাপকে, ব্যাপক, বাবা, বাহক, বারাক, ",yes
ফিল্টারবিহীন,filtervihin,ফিলতারবিহীন,filtaravihin," filtervihin, filteryukt, filderer, flater, flyter, "," ফিল্টারবিহীন, ফিল্টারযুক্ত, ফিল্ডারের, ফ্ল্যাটের, ফ্লাইটের, ",yes
ফিল্টারযুক্ত,filteryukt,ফিলতারযুক্ত,filtarayukt," filteryukt, filtervihin, filderer, flater, flyter, "," ফিল্টারযুক্ত, ফিল্টারবিহীন, ফিল্ডারের, ফ্ল্যাটের, ফ্লাইটের, ",yes
বন্ধে,vandhe,বনধে,vanadhe," vandhe, kandhe, gandhe, vanate, avadhe, "," বন্ধে, কাঁধে, গন্ধে, বানাতে, অবাধে, ",yes
অগ্রিম,agrim,অগরিম,agarim," garam, agrim, karim, agarit, aadim, "," গরম, অগ্রিম, করিম, অগঠিত, আদিম, ",yes
অর্থের,arther,অরটের,arter," arter, arther, rater, garter, atter, "," আড়তের, অর্থের, রাতের, গর্তের, আটটার, ",yes
সর্বত্রই,sarvatrai,সরত্রই,saratrai," sarvatrai, sarasari, sarvatra, sapatra, karatai, "," সর্বত্রই, সরাসরি, সর্বত্র, সৎপাত্র, করাটাই, ",yes
মার্কেট,market,মারকেট,market," market, make, marker, markel, markin, "," মার্কেট, মাকে, মার্কার, মরকেল, মার্কিন, ",yes
পরিচ্ছেদের,parichseader,পরিছছেদের,parishseader," parishader, parichseader, parichseade, prashasanar, prashasker, "," পরিষদের, পরিচ্ছেদের, পরিচ্ছেদে, প্রশাসনের, প্রশাসকের, ",yes
বিক্রেতারা,bikretara,বিকরেতারা,vikaretara," bikretara, vikrut, vikrutir, vikrata, vikruti, "," বিক্রেতারা, বিকৃত, বিকৃতির, বিক্রতা, বিকৃতি, ",yes
আকৃষ্ট,aakrisht,আকৃষত,aakrushat," aakrisht, aakarshan, aakarshane, akroshta, akrosh, "," আকৃষ্ট, আকর্ষণ, আকর্ষণে, আক্রোশটা, আক্রোশ, ",yes
থ্রিপিস,thripis,তরিপিস,taripis," thripis, tarkis, karitis, taranis, tarapin, "," থ্রিপিস, টার্কিস, করিতিস, তারনিস, তারপীন, ",yes
টাঙ্গাইল,tongail,টাংগাইল,tungail," tongail, tongaile, tongailer, tungi, aungai, "," টাঙ্গাইল, টাঙ্গাইলে, টাঙ্গাইলের, তুঙ্গী, ঔঁগাই, ",yes
হাফসিল্ক,hafsilk,হাফসিলক,haisilak," hasilam, jaitilak, hafsilk, hasil_kara, "," হাসিলাম, জয়তিলক, হাফসিল্ক, হাসিল_করা, ",yes
সেপ্র,sepra,সেপর,sepr," sepra, ser, opr, sepe, swar, "," সেপ্র, সের, ওপর, ছেপে, স্বর, ",yes
প্রিন্ট,print,পরিন্ট,parint," parint, parit, parinti, parini, karit, "," পরিণত, পারিত, পরিণতি, পারিনি, করিত, ",no
জর্জেট,jarjet,জরজেট,jarjet," jarjet, jarie, jarit, jarjes, jajer, "," জর্জেট, জড়িয়ে, জড়িত, জর্জেস, জজের, ",yes
শার্ট,shart,শারত,sharat," shart, bharat, sharir, shakt, kharap, "," শার্ট, ভারত, শরীর, শাক্ত, খারাপ, ",yes
ব্যতিক্রমী,vyatikrmi,েবতিক্রমী,batikrami," atikram, atikrami, atikramk, batkharati, bauthakurani, "," অতিক্রম, অতিক্রমী, অতিক্রামক, বাটখারাটি, বউঠাকুরানীর, ",no
বিক্রেতাদের,bikretader,বিকরেতাদের,vikaretader," bikretader, vikrut, vikrutir, vikrutite, vikrata, "," বিক্রেতাদের, বিকৃত, বিকৃতির, বিকৃতিতে, বিক্রতা, ",yes
অন্যসব,anyasav,অেনসব,ansav," sansar, aisav, anya, anusar, ansar, "," সংসারে, এইসব, অন্যায়, অনুসারে, আনসার, ",no
বৃদ্ধি,vruddhi,বৃদদি,vruddi," vruddhi, vrudh, vrudhi, vruddhir, vruddha, "," বৃদ্ধি, বৃদ্ধ, বৃদ্ধই, বৃদ্ধির, বৃদ্ধা, ",yes
ক্রেতা,kreta,করেতা,kareta," karia, karta, karata, kreta, karit, "," করিয়া, কর্তা, করাটা, ক্রেতা, করিত, ",yes
বিক্রেতদের,bikretder,বিকরেতদের,vikaretder," bikretder, vikrut, vikrutir, vikruti, vikrutite, "," বিক্রেতদের, বিকৃত, বিকৃতির, বিকৃতি, বিকৃতিতে, ",yes
চলচ্চিত্র,chalachchitra,চলচচিত্র,chalchachitra," chalachchitra, chalachitra, chalachchitrer, chalachchitrai, chalachchitre, "," চলচ্চিত্র, চলচিত্র, চলচ্চিত্রের, চলচ্চিত্রই, চলচ্চিত্রে, ",yes
প্রচুর,prachur,পরচুর,parchur," prachur, panchur, parchi, prachar, parch, "," প্রচুর, পঞ্চুর, পারছি, প্রচার, পারছে, ",yes
ক্যাটরিনা,catrina,েকাটরিনা,katrina," karia, kathin, catrina, karuna, katia, "," করিয়া, কঠিন, ক্যাটরিনা, করুণা, কাটিয়া, ",yes
থ্রিজি,thriji,টরিজি,toriji," thriji, thridi, ariji, tirmiji, torai, "," থ্রিজি, থ্রিডি, অরিজিৎ, তিরমিজি, তোরই, ",yes
তরঙ্গ,taranga,তরংগ,tarang," tarang, taranga, torang, tarai, sarvang, "," তরঙ্গে, তরঙ্গ, তোরঙ্গে, তরাই, সর্বাঙ্গ, ",yes
প্রজন্মের,prajnmer,পরজন্মের,parajanmer," prajnmer, purvajanmer, parajayer, prajanner, parijander, "," প্রজন্মের, পূর্বজন্মের, পরাজয়ের, প্রজননের, পরিজনদের, ",yes
প্রযুক্তির,prayukti,পরযুক্তির,parayukti," prayukti, tarkayukti, papamukti, parayati, prayuktai, "," প্রযুক্তি, তর্কযুক্তি, পাপমুক্তি, পর্যায়টি, প্রযুক্তই, ",no
লিগ্যাল,ligyal,লিজ্ঞাল,ligyal," ligyal, vigyan, liga, lagil, ligyasy, "," লিগ্যাল, বিজ্ঞান, লীগ, লাগিল, লিগ্যাসি, ",yes
লাইসেন্সিং,lisencing,লাইসেনসিং,lisensing," lisencing, listening, lisenser, lisens, lessons, "," লাইসেন্সিং, listening, লাইসেন্সের, লাইসেন্সে, lessons, ",yes
পরামর্শের,paramrsher,পরামরশের,paramrsher," paramrsher, paramarsh, paramrshei, paramrsh, paramrsho, "," পরামর্শের, পরামর্শ, পরামর্শেই, পরামর্শে, পরামর্শও, ",yes
আর্নেস্টমানি,arnestmani,আরনেস্টমানি,arnestmani," arnestmani, aranya_simant, arunsarathi, aranya_sannyasi, aranyawas, "," আর্নেস্টমানি, অরণ্য_সীমান্ত, অরুণসারথি, অরণ্য_সন্ন্যাসী, অরণ্যবাস, ",yes
অযোগ্য,ayogya,অযোজ্ঞ,ayojna," yojna, yojan, ajna, ayogya, jyosna, "," যোজনা, আয়োজন, আজ্ঞা, অযোগ্য, জ্যোৎস্না, ",yes
