নির্মম,nirmam,নিরম,niram," niyam, naram, nirmam, niam, nirad, "," নিয়ম, নরম, নির্মম, নিয়ামে, নীরদ, ",yes
নিষ্ঠুরভাবে,nishthurbhave,নিষটুরভাবে,nishturabhave," nishthurbhave, nishthuracharan, nishthur, nishthuratam, nishthurta, "," নিষ্ঠুরভাবে, নিষ্ঠুরাচরণ, নিষ্ঠুর, নিষ্ঠুরতম, নিষ্ঠুরতা, ",yes
হত্যাও,hatyao,হেতাও,heta," neta, yeta, hatha, beta, haia, "," নেতা, যেটা, হঠাৎ, বেটা, হইয়া, ",no
রাজ্যে,raje,রােজে,raje," raje, raja, raji, baje, saje, "," রাজ্যে, রাজা, রাজী, বাজে, সেজে, ",yes
অ্যাগ্রোফোবিয়ায়,agrophobia,েঅাগ্রোফোবিয়ায়,agrophobia," agrophobia, agarvati, agorver, agarvatir, jiographic, "," অ্যাগ্রোফোবিয়ায়, আগরবাতি, অগৌরবের, আগরবাতির, জিওগ্রাফিক, ",yes
আক্রান্ত,akrant,আকরান্ত,akrant," akrant, sakrant, atyant, aklant, karat, "," আক্রান্ত, সংক্রান্ত, অত্যন্ত, অক্লান্ত, করত, ",yes
আগ্নেয়াস্ত্র,agnaastra,আগনেয়াস্ত্র,agnyastra," anyatra, agnaastra, agnaastrati, anusthan, anastha, "," অন্যত্র, আগ্নেয়াস্ত্র, আগ্নেয়াস্ত্রটি, অনুষ্ঠান, অনাস্থা, ",yes
আন্দোলন,andolan,আনদোলন,andolan," andolan, andolane, andolaner, andolanke, andolit, "," আন্দোলন, আন্দোলনে, আন্দোলনের, আন্দোলনকে, আন্দোলিত, ",yes
জন্যও,janyao,জেনও,jeno," geno, jano, keno, eno, jane, "," জেনো, জানো, কেনো, এনো, জানে, ",no
প্রতিদিন,pratidin,পরতিদিন,paratidin," pratidin, paradin, pratidini, pratidan, pratidiner, "," প্রতিদিন, পরদিন, প্রতিদিনই, প্রতিদান, প্রতিদিনের, ",yes
শুক্রবার,shukrabar,শুকরবার,shukarbar," shukrabar, shukurbar, shukrobar, shukrabark, shukrabaro, "," শুক্রবার, শুকুৰবাৰে, শুক্রবারে, শুক্রবারকে, শুক্রবারও, ",yes
ব্যতিত,vyatit,বাতিত,baatit," baati, baahir, baatir, balit, atit, "," বাতি, বাহির, বাতির, বলিত, অতীত, ",no
মার্কেটস্হ,marketsh,মারকেটস্হ,marketsh," marketsh, market, marketer, marketeo, maritesh, "," মার্কেটস্হ, মার্কেট, মার্কেটের, মার্কেটেও, মারিতেছ, ",yes
দপ্তর,daptar,দপতর,dapatar," daptar, kaatar, paatar, darpatan, dapater, "," দপ্তরে, কাতর, পাতার, দরপতন, দাপটের, ",no
ছাত্রলীগ,chharalig,ছাটরলীগ,chhatralig," chharalig, chhatralaya, gatralehan, "," ছাত্রলীগ, ছাত্রালয়, গাত্রলেহন, ",yes
ব্যাংক,vyank,বাাংক,baak," baak, baap, baas, baad, baan, "," বাক, বাপ, বাস, বাদ, বাণ, ",no
শিক্ষা,shiksha,শিক্কা,shikka," shikha, shiksha, shikar, shika, shokka, "," শিখা, শিক্ষা, শীকর, শিকায়, শোককেই, ",yes
ওয়ার্কশপ,warkshap,ওয়ারকশপ,warkashap," warkshap, warkshape, jwarkashi, aarkshak, araksha, "," ওয়ার্কশপ, ওয়ার্কশপে, জ্বরকাশি, আরক্ষক, আরক্ষা, ",yes
অনুষ্ঠি,anushthi,অনুষতি,anushati," anushtit, anumati, anusthanti, anushad, anusari, "," অনুষ্ঠিত, অনুমতি, অনুষ্ঠানটি, অনুষদ, অনুসারী, ",no
অনুপস্থিতিকালীন,anupsthitikalin,অনুপসটিতিকালীন,anupstitikalin," anupsthitikalin, anupsthiticale, anupsthith, anupsthitite, anupsthitetake, "," অনুপস্থিতিকালীন, অনুপস্থিতিকালে, অনুপস্থিত, অনুপস্থিতিতে, অনুপস্থিতিটাকে, ",yes
বিদ্যালয়ের,vidyalyer,বিদাালয়ের,bidalayer," bidayer, balayer, himalayer, bidaler, bedaler, "," বিদায়ের, বলাইয়ের, হিমালয়ের, বিড়ালের, বেড়ালের, ",no
উপাচার্য,upacharya,উপাচাের,upachar," upahar, upachar, pachar, upacharya, prachar, "," উপহার, উপাচার, পাচার, উপাচার্য, প্রচার, ",yes
প্রফেসর,praphesar,পরফেসর,paraphesar," praphesar, prafesar, proffesar, paravast, parvases, "," প্রফেসর, প্রফেসার, প্রোফেসার, পরাস্ত, পরবাসে, ",yes
দায়িত্ব,dawitva,দায়িত,dawiya," dakia, bariya, dawitva, jatiya, nariya, "," ডাকিয়া, বাড়িয়া, দায়িত্ব, জাতীয়, নাড়িয়া, ",yes
ব্রিটিশ,british,রিটিশ,ritish," british, satish, nitish, ilish, notish, "," ব্রিটিশ, সতীশ, নিতীশ, ইলিশ, নোটিশ, ",yes
দ্বিতীয়,dvitiya,দিতীয়,ditiya," dvitiya, diteya, mitiya, diteyae, jatiya, "," দ্বিতীয়, দিতেও, মিটাইয়া, দিতেছে, জাতীয়, ",no
বৃহত্তম,vruhattam,বৃহটতম,vruhattam," vruhattam, vruhattar, vruhattva, vruhatka, vruhat, "," বৃহত্তম, বৃহত্তর, বৃহত্ত্ব, বৃহত্কায়, বৃহত্, ",yes
অবিভক্ত,avibhak,অবিভকত,avibhakt," vibhake, avibhak, vishakt, vibhakti, avibechak, "," বিভাকে, অবিভক্ত, বিষাক্ত, বিভক্তি, অবিবেচক, ",yes
কাউন্সিল,council,কাউনসিল,counsil," council, counsilar, cousin, counseler, countir, "," কাউন্সিল, কাউন্সিলর, cousin, কাউন্সিলের, কাউন্টির, ",yes
অ্যাসেম্বলীর,assembeli,েঅাসেম্বলীর,acembeli," assembeli, cembel, cambeli, accomplish, akmpit, "," অ্যাসেম্বলির, কেম্বেল, ক্যাম্বেলি, accomplish, আকম্পিত, ",no
সদস্য,sadasya,সদেস,sades," sade, sandeh, pade, hayes, aadesh, "," সাড়ে, সন্দেহ, পাড়ে, হয়েছে, আদেশ, ",no
সত্ত্বেও,sattweo,সতট্বেও,sattbeo," sattweo, tasttbeo, satter, sattve, satikeo, "," সত্ত্বেও, তৎসত্ত্বেও, সাতটার, সত্ত্বে, সতীকেও, ",yes
মৃত্যুকালে,mrityukale,মৃেতুকালে,mritukale," mrityukale, mrityukal, mrityukaler, mrityuke, mridukanth, "," মৃত্যুকালে, মৃত্যুকাল, মৃত্যুকালের, মৃত্যুকে, মৃদুকণ্ঠে, ",yes
ব্যাংকে,vyanke,বাাংকে,bake," bake, baki, make, baje, buke, "," বকে, বাকি, মাকে, বাজে, বুকে, ",no
দৃষ্টান্ত,drustant,দৃষতান্ত,drushatanta," drustanta, drushyata, drushtite, drushti, drushtipat, "," দৃষ্টান্তও, দৃশ্যটা, দৃষ্টিতেই, দৃষ্টি, দৃষ্টিপাত, ",no
নিতান্তই,nitantai,নিতানতই,nitantai," nitantai, nitanta, nirantar, nilkantai, nutantar, "," নিতান্তই, নিতান্ত, নিরন্তর, নীলকান্তই, নূতনতর, ",yes
বিশ্বজোড়া,vishwajora,বিশজোড়া,vishjora," vishwajora, vishforan, deshjora, vishphora, pishmora, "," বিশ্বজোড়া, বিষ্ফোরণ, দেশজোড়া, বিষফোড়া, পিছমোড়া, ",yes
সাহায্য,sahayya,সাহাযা,sahaya," sahya, sahayya, sahasa, samay, sahaya, "," সহ্য, সাহায্য, সহসা, সময়, সহায়া, ",yes
তীব্ৰভাৱে,tibrabhave,তীৰভাৱে,tirabhave," prabhave, tibrabhave, thikabhave, nirdabhave, dinabhave, "," প্রভাবে, তীব্রভাবে, ঠিকভাবে, নির্দয়ভাবে, দীনভাবে, ",no
নিত্যানন্দ,nityanand,নিেতানন্দ,nitananda," nirananda, nityanand, niranande, satananda, natnayane, "," নিরানন্দ, নিত্যানন্দ, নিরানন্দে, সতানন্দ, নতনয়নে, ",yes
ভোক্তাঽধিষ্ঠাতৃরূপ,bhoktadhishthatrurup,ভোকতাঽধিষ্ঠাতৃরূপ,bhokatadhishthatrurup," bhoktadhishthatrurup, bhaktader, bhaktite, bhaktitattva, bhaktitattber, "," ভোক্তাঽধিষ্ঠাতৃরূপ, ভক্তদের, ভক্তিতে, ভক্তিতত্ত্ব, ভক্তিতত্ত্বের, ",yes
অনূর্ধ্ব,anoordhv,অনূরদ্ব,anoornav," anoordhv, anoorat, anirna, anuranan, anirnit, "," অনূর্ধ্ব, অনুরত, অনির্ণয়, অনুরণন, অনির্ণীত, ",yes
বিশ্বকাপের,vishwakaper,বিশকাপের,vishakaper," vishwakaper, vishwakape, vishwakapeo, vishakhapara, vishwacap, "," বিশ্বকাপের, বিশ্বকাপে, বিশ্বকাপেও, বিশখাপর, বিশ্বকাপ, ",yes
পাকিস্তান,pakistan,পাকিসতান,pakistan," pakistan, pakistani, pakistaner, pakistaneo, pakistanei, "," পাকিস্তান, পাকিস্তানি, পাকিস্তানের, পাকিস্তানেও, পাকিস্তানেই, ",yes
অগাস্ট,august,অগাসত,agasat," aghat, aasa, agrsar, avasar, aahat, "," আঘাত, আসা, অগ্রসর, অবসর, আহত, ",no
মধ্যরাতে,madhyarate,মেধরাতে,medhrate," meshate, moderate, medhake, madhyarate, madhurite, "," মেশাতে, মডারেট, মেধাকে, মধ্যরাতে, মাধুরীতে, ",yes
স্টিয়ারিং,stearing,সতিয়ারিং,satiaring," stearing, swashironame, sashrunetre, swashironamer, swashrenian, "," স্টিয়ারিং, স্বশিরোনামেই, সাশ্রুনেত্রে, স্বশিরোনামের, স্বশ্রেণীয়, ",yes
ঘনিষ্ঠরা,ghanishthra,ঘনিষটরা,ghanishatra," ghanishitar, ghanishth, ghanishita, ghanishthra, ghanishthta, "," ঘনিষ্ঠতার, ঘনিষ্ঠ, ঘনিষ্ঠতাও, ঘনিষ্ঠরা, ঘনিষ্ঠতা, ",yes
প্রসঙ্গে,prasang,পরসঙ্গে,parasng," prasang, parashu, parasav, parano, patang, "," প্রসঙ্গে, পরশু, পরাভব, পরানো, পতঙ্গ, ",yes
স্পিকার,spikar,সপিকার,sapikar," swikar, sarkar, balikar, spikar, shikar, "," স্বীকার, সরকার, বালিকার, স্পিকার, শীকর, ",yes
প্রস্তাবে,prastave,পরস্তাবে,parastave," prastave, prastab, parasav, prastaver, prasrave, "," প্রস্তাবে, প্রস্তাব, পরাভব, প্রস্তাবের, প্রস্রাবে, ",yes
সম্মতি,sammathi,সমতি,samati," samay, samastai, samapti, sampatti, kamati, "," সময়, সমস্তই, সমাপ্তি, সম্পত্তি, কমতি, ",no
মূল্যে,moolye,মূেলে,mule," mule, muly, mele, mile, mul, "," মূলে, মূল্য, মেলে, মিল, মূল, ",no
ব্যবস্থাও,vyavasthao,বাবস্থাও,bavasthao," avastha, avasthan, avasthar, avasthao, vyavasthao, "," অবস্থা, অবস্থান, অবস্থার, অবস্থাও, ব্যবস্থাও, ",yes
হত্যালীলার,hatyalilar,হতাালীলার,hatalilar," hatyalilar, hadlewala, "," হত্যালীলার, হাতলওয়ালা, ",yes
পাল্টে,psalte,পালতে,palte," palte, balle, paate, balite, palie, "," পলতে, বললে, পাতে, বলিতে, পালিয়ে, ",no
স্বাভাবিক,swabhavik,সাভাবিক,savavik," samajik, sanvadik, sarvik, sahasik, savatike, "," সামাজিক, সাংবাদিক, সার্বিক, সাহসিক, সভাটিকে, ",no
টেস্ট,test,টেসত,tesat," test, esav, yesav, that, ferat, "," টেস্ট, এসব, যেসব, ঠাট, ফেরত্, ",yes
বন্ধুদের,bandhuder,বনধুদের,bandhuder," bandhuder, bandhur, bandhutber, bandhudero, bandhuke, "," বন্ধুদের, বন্ধুর, বন্ধুত্বের, বন্ধুদেরও, বন্ধুকে, ",yes
ঈশ্বরের,ishwarer,ঈশরের,ishrer," vishwer, ishwarer, misrer, ishper, mishner, "," বিশ্বের, ঈশ্বরের, মিসরের, ইশপের, মিশনের, ",yes
যুক্তিসিদ্ধ,yuktisiddh,যুকতিসিদ্ধ,yuktisiddh," yuktisiddh, yuktisangat, yuktas, ekatisah, ekzora, "," যুক্তিসিদ্ধ, যুক্তিসঙ্গত, যুক্তায়স, একটিসহ, একজোড়া, ",yes
নাস্তিক,nasthik,নাসতিক,nastik," nasthik, naitik, rasik, nast, aastik, "," নাস্তিক, নৈতিক, রসিক, নষ্ট, আস্তিক, ",yes
সাক্ষ্য,saakshya,সাক্ক্য,sakkya," satya, sahya, sakhya, sankhya, sainya, "," সত্য, সহ্য, সখ্য, সংখ্যা, সৈন্য, ",no
ঈশ্বর,eshwar,ঈশর,ishar," ihar, ashar, ishara, isha, irshar, "," ইহার, আশার, ঈশারা, ঈশা, ঈর্ষার, ",no
অসম্ভব,asambhava,অসবব,asabob," labob, sabab, asbabeo, asbabgulor, asbabguli, "," লড়ব, সাবাব, আসবাবেও, আসবাবগুলোর, আসবাবগুলির, ",no
ট্রান্সফরমেশনের,transpharmeshner,তরান্সফরমেশনের,taranspharmeshner," transpharmeshner, transpharming, transparancy, transpher, tarunsmajer, "," ট্রান্সফরমেশনের, ট্রান্সফরমিং, ট্রান্সপারেন্সি, ট্রান্সফার, তরুণসমাজের, ",yes
বঙ্গবন্ধুকে,bangabandhuke,বংগবন্ধুকে,bangabandhuke," bangabandhuke, bangabandhu, bangabandhur, bangabandhumarch, bankubabuke, "," বঙ্গবন্ধুকে, বঙ্গবন্ধু, বঙ্গবন্ধুর, bangabandhumarch, বঙ্কুবাবুকে, ",yes
ধানমন্ডির,dhanmandir,ধানমনদির,dhanmandir," dhanmandir, dhanmandi, dhanmandite, dhanmaner, dhanvander, "," ধানমন্ডির, ধানমন্ডি, ধানমন্ডিতে, ধনমানের, ধনবানদের, ",yes
নম্বর,nambar,নবর,nabar," nambar, babar, khabar, karbar, najar, "," নম্বর, বাবর, খবর, করবার, নজর, ",yes
ভুক্তভোগীদের,bhuktavogider,ভুকতভোগীদের,bhukatvogider," bhuktavogider, bhuktavogi, bhuktavogira, bhaktivre, baktavyer, "," ভুক্তভোগীদের, ভুক্তভোগী, ভুক্তভোগীরা, ভক্তিভরে, বক্তব্যের, ",yes
নিচ্ছে,nicche,নিছে,niche," niche, nicher, nichu, nicche, miche, "," নীচে, নিচের, নীচু, নিচ্ছে, মিছে, ",yes
সম্পূর্ণ,sampoorn,সপূর্ণ,sapurna," purna, saspurna, sarpurna, sapura, apurna, "," পূর্ণ, সস্পূর্ণ, সারপূর্ণ, সাপুড়া, অপূর্ণ, ",no
নির্দেশনা,nirdeshna,নিরডেশনা,nirdeshna," nirdeshna, nirdesh, anirdeshya, nirdeshnar, nirdeshan, "," নির্দেশনা, নির্দেশ, অনির্দেশ্য, নির্দেশনার, নির্দেশন, ",yes
সম্মেলনের,sammelner,সমেলনের,samelner," sammelner, samaner, sammelne, sammaner, ramener, "," সম্মেলনের, সামনের, সম্মেলনে, সম্মানের, রমেনের, ",yes
চন্দ্রিমা,chandrima,চনদ্রিমা,chandrima," chandrima, chandrama, chandra, chandrika, chandramar, "," চন্দ্রিমা, চন্দ্রমা, চান্দ্র, চন্দ্রিকা, চন্দ্রমার, ",yes
উদ্যান,udyan,উদাান,udan," udan, udai, udyan, udar, ujan, "," উদান, উদয়, উদ্যান, উদার, উজান, ",yes
পার্শ্ববর্তী,parshvabarti,পারশ্ববর্তী,parshwabarti," parshvabarti, pareshbabur, pareshbabu, barshabrat, pareshbabuke, "," পার্শ্ববর্তী, পরেশবাবুর, পরেশবাবু, বর্ষাব্রত, পরেশবাবুকে, ",yes
অস্ত্র,astra,অসত্র,asatra," astra, satya, asatya, asahya, yatra, "," অস্ত্র, সত্য, অসত্য, অসহ্য, যাত্রা, ",yes
বিস্ফোরক,bisphork,বিসফোরক,bisphork," bisphork, bisphoran, bisphorne, bisphorner, bisphornakari, "," বিস্ফোরক, বিস্ফোরণ, বিস্ফোরণে, বিস্ফোরণের, বিস্ফোরণকারী, ",yes
দ্রব্য,dravya,দরব্য,darvya," dravya, darja, bariya, nariya, daya, "," দ্রাব্য, দরজা, বাড়িয়া, নাড়িয়া, দয়া, ",no
ক্ষতিকারক,kshatikarak,খতিকারক,khatikarak," kshatikarak, hanikarak, khatkar, kadakari, ghatekare, "," ক্ষতিকারক, হানিকারক, খট্‌কার, কড়াকড়ি, ঘটাকরে, ",yes
পদার্থ,paxarth,পদারত,padarat," parat, aadalat, padahat, padarpan, padat, "," পরত, আদালত, পদাহত, পদার্পণ, পড়ত, ",no
শোভাযাত্রা,shobhayatra,শোভাযাতরা,shobhayatra," shobhayatra, shubhayatra, shabayatra, shabder, shubhadrushtir, "," শোভাযাত্রা, শুভযাত্রার, শবযাত্রা, শব্দের, শুভদৃষ্টির, ",yes
বিক্ষোভ,vikshov,বিক্কোভ,vikkov," vikshov, vikroy, vikot, vikoy, "," বিক্ষোভ, বিক্রয়, বিকোত, বিকোয়, ",yes
নিষিদ্ধ,nishidh,নিষিদড,nishidad," nishidh, nishidin, nishipal, nishad, nishithedactor, "," নিষিদ্ধ, নিশিদিন, নিশিপাল, নিষাদ, নিশীথেডাক্তার, ",yes
সহকর্মীদের,sahakarmider,সহকরীদের,sahakarider," sahakarmider, sahakari, sahakare, sahayatrider, sahacharider, "," সহকর্মীদের, সহকারী, সহকারে, সহযাত্রীদের, সহচরীদের, ",yes
প্রতিবেশীরা,pratibeshira,পরতিবেশীরা,paratibeshira," pratibeshira, pratibeshini, pratibeshinira, pratibeshike, pratibeshider, "," প্রতিবেশীরা, প্রতিবেশিনী, প্রতিবেশিনীরা, প্রতিবেশীকে, প্রতিবেশীদের, ",yes
উদ্ঘাটন,udghaton,উদঘাটন,udaghaton," udghaton, aghaton, uthiten, udetten, uthten, "," উদ্ঘাটন, অঘটন, উঠিতেন, উড়েছেন, উঠতেন, ",yes
পরিদর্শক,paridarshak,পরিদরশক,paridarshak," paridarshak, paridarshan, paridarshane, paramarshak, pardarshak, "," পরিদর্শক, পরিদর্শন, পরিদর্শনে, পরামর্শক, পারদর্শক, ",yes
রব্বানীর,rabbani,রবানীর,rabani," ramani, jaani, raptani, paani, amani, "," রমণী, জানি, রপ্তানি, পানির, আমানী, ",no
সমর্থকরা,samarthakara,সমরটকরা,samartakara," samarthakara, samarthakera, samarthan, samaptakari, samarthakader, "," সমর্থকরা, সমর্থকেরা, সমর্থন, সমাপ্তকারী, সমর্থকদের, ",yes
ইচ্ছা,iccha,ইছা,icha," iccha, cha, isha, achha, vibha, "," ইচ্ছা, চা, ঈশা, আচ্ছা, বিভা, ",yes
অভিযুক্তের,abhiyukter,অভিযুকতের,abhiyukter," abhiyukter, abhiyukt, abhiyuktak, abhiyoktara, abhiyokta, "," অভিযুক্তের, অভিযুক্ত, অভিযুক্তকে, অভিযোক্তারা, অভিযোক্তা, ",yes
বিশ্বাস,vishwas,বিশাস,vishas," vishwas, vishay, visham, vishal, vishan, "," বিশ্বাস, বিষয়ে, বিষম, বিশাল, ভিশন, ",yes
পরিস্থিতিতে,paristhitite,পরিসটিতিতে,paristitite," paristhitite, paristhite, paristhitike, paristhititei, paristiter, "," পরিস্থিতিতে, পরিস্থিতি, পরিস্থিতিকে, পরিস্থিতিতেই, পরিস্থিতির, ",yes
শব্দটিকে,shabdatike,শদটিকে,shadatike," shaktike, shabdatike, shabdatake, savatike, sthapatike, "," শক্তিকে, শব্দটিকেই, শব্দটাকে, সভাটিকে, স্থপতিকে, ",no
পরিস্থিতিতেও,paristhitite,পরিসতিতিতেও,paristitite," paristhitite, paristhite, paristhitike, paristhititei, paristiter, "," পরিস্থিতিতে, পরিস্থিতি, পরিস্থিতিকে, পরিস্থিতিতেই, পরিস্থিতির, ",no
প্রতিটি,pratity,পরতিটি,paratity," pratity, partite, paraite, pratiti, pratita, "," প্রতিটি, পার্টিতে, পরাইতে, প্রতীতি, প্রতিটা, ",yes
ক্ষতিপূরণ,kshatipuran,খতিপূরণ,khatipooran," khatpura, khatiber, khatibar, ghatibar, katiber, "," খাটপুরা, খাটাইবার, খাটিবার, ঘটিবার, কাটাইবার, ",no
ধর্মীয়,dharmian,ধরীয়,dhariya," dhariwa, dhairya, chadiya, dharaiya, jhariya, "," ধরিয়া, ধৈর্য, ছাড়িয়া, ধরাইয়া, ঝাড়িয়া, ",no
অধিকারসংক্রান্ত,adhikarsankrant,অধিকারসংকরান্ত,adhikarsankarant," adhikarsankrant, adhikarsankirna, adhikar_kara, adhikaran_carak, adhikarer, "," অধিকারসংক্রান্ত, অধিকারসংকীর্ণ, অধিকার_করা, অধিকরণ_কারক, অধিকারের, ",yes
মোকদ্দমা,mokddama,মোকডদমা,mokddama," mokddama, makddama, makddamar, mokddmar, makrdama, "," মোকদ্দমা, মকদ্দমা, মকদ্দমার, মোকদ্দমার, মকর্দমা, ",yes
মূল্যমানের,mulyamaner,মূলামানের,mulamaner," mulyamaner, musalmaner, muldhaner, melamyner, multaner, "," মূল্যমানের, মুসলমানের, মূলধনের, মেলামাইনের, মুলতানের, ",yes
নিষ্পত্তি,nishpatti,নিষপত্তি,nishapatti," nishpatti, nishpattir, nishpattii, nishpattio, nishkapatta, "," নিষ্পত্তি, নিষ্পত্তির, নিষ্পত্তিই, নিষ্পত্তিও, নিষ্কপটতা, ",yes
ফিল্ডারের,filderer,ফিলদারের,phildarer," haldarer, phulsarer, plidarer, filderer, phalatar, "," হালদারের, ফুলশরের, প্লীডারের, ফিল্ডারের, ফলাটার, ",yes
